<!ELEMENT message (from, to+, subject, body?, attachment*)>
<!ELEMENT from (#PCDATA)>
<!ELEMENT to (#PCDATA)>
<!ELEMENT body (#PCDATA)>
<!ELEMENT attachment (#PCDATA)>
<!ELEMENT subject (#PCDATA)>